{"$schema":"https://json-schema.org/draft/2020-12/schema","$id":"release_evidence_attempt.schema.json","title":"Rendro preserved release evidence journey attempt","type":"object","required":["schema_version","role","id","release","candidate_commit_sha","source","facts","narrative","import","redaction","supersedes"],"additionalProperties":false,"properties":{"schema_version":{"const":1},"role":{"const":"journey_attempt"},"id":{"type":"string","pattern":"^RE-V134-JOURNEY-[0-9]{3}$"},"release":{"$ref":"#/$defs/release"},"candidate_commit_sha":{"$ref":"#/$defs/sha"},"source":{"$ref":"#/$defs/source"},"facts":{"$ref":"#/$defs/facts"},"narrative":{"$ref":"#/$defs/narrative"},"import":{"$ref":"#/$defs/import"},"redaction":{"$ref":"#/$defs/redaction"},"supersedes":{"type":"array","maxItems":8,"items":{"type":"string","pattern":"^RE-V134-JOURNEY-[0-9]{3}$"}}},"$defs":{"sha":{"type":"string","pattern":"^[0-9a-f]{40}$"},"sha256":{"type":"string","pattern":"^[0-9a-f]{64}$"},"release":{"type":"object","required":["version","tag","candidate_commit_sha"],"additionalProperties":false,"properties":{"version":{"const":"1.3.4"},"tag":{"const":"v1.3.4"},"candidate_commit_sha":{"$ref":"#/$defs/sha"}}},"source":{"type":"object","required":["path","sha256","commit"],"additionalProperties":false,"properties":{"path":{"type":"string","pattern":"^priv/journey_evidence/[A-Za-z0-9._-]+\\.json$"},"sha256":{"$ref":"#/$defs/sha256"},"commit":{"$ref":"#/$defs/sha"}}},"facts":{"type":"object","required":["advisory","candidate_sha","cleanup","commands","next_action","outcome","prerequisite_sha","reason","schema_version","version"],"additionalProperties":true,"properties":{"advisory":{"const":true},"candidate_sha":{"$ref":"#/$defs/sha"},"cleanup":{"const":"removed"},"commands":{"type":"array","minItems":1,"items":{"type":"string","minLength":1}},"next_action":{"type":"string","minLength":1},"outcome":{"const":"failure"},"prerequisite_sha":{"$ref":"#/$defs/sha"},"reason":{"type":"string","minLength":1},"schema_version":{"const":1},"version":{"const":"1.3.4"}}},"narrative":{"type":"object","required":["role","path","sha256"],"additionalProperties":false,"properties":{"role":{"const":"explanatory_sidecar"},"path":{"type":"string","pattern":"^journey/journey-[0-9]{3}\\.md$"},"sha256":{"$ref":"#/$defs/sha256"}}},"import":{"type":"object","required":["imported_at","reason"],"additionalProperties":false,"properties":{"imported_at":{"const":"2026-08-26"},"reason":{"type":"string","minLength":1,"maxLength":240}}},"redaction":{"type":"object","required":["classification","reason"],"additionalProperties":false,"properties":{"classification":{"const":"none"},"reason":{"const":"Source contained no paths, ports, PIDs, bodies, caches, headers, tokens, secrets, or generated payloads."}}}}}
