{"schema_version":1,"role":"journey_attempt","id":"RE-V134-JOURNEY-006","release":{"version":"1.3.4","tag":"v1.3.4","candidate_commit_sha":"f03c78bab54efe1cd1596d51cf3f28193232e2a3"},"candidate_commit_sha":"f03c78bab54efe1cd1596d51cf3f28193232e2a3","source":{"path":"priv/journey_evidence/phoenix_clean_room_1.3.4_sixth_failed_attempt.json","sha256":"80a69cb16d783a59f0ca6be4d04d7db4812b562bc91a36309f358f2585a0abda","commit":"204f2318b4f3d07109718a2b28fcbe5ebbe01ae8"},"facts":{"advisory":true,"candidate_sha":"f03c78bab54efe1cd1596d51cf3f28193232e2a3","cleanup":"removed","commands":["mix archive install hex phx_new 1.8.5 --force","mix phx.new --no-install --no-ecto --no-html --no-assets --no-mailer","mix deps.get"],"next_action":"Inspect the observed current Hex lock tuple before authorizing any new attempt.","outcome":"failure","prerequisite_sha":"f03c78bab54efe1cd1596d51cf3f28193232e2a3","reason":"invalid_rendro_lock","schema_version":1,"version":"1.3.4"},"narrative":{"role":"explanatory_sidecar","path":"journey/journey-006.md","sha256":"5b4b639156a7ed6351431663a2103be2bf024cda1bc072ca86ab11111d71afed"},"import":{"imported_at":"2026-08-26","reason":"preserved sixth bounded clean-room failure without re-asserting it"},"redaction":{"classification":"none","reason":"Source contained no paths, ports, PIDs, bodies, caches, headers, tokens, secrets, or generated payloads."},"supersedes":[]}
