{"schema_version":1,"role":"journey_attempt","id":"RE-V134-JOURNEY-005","release":{"version":"1.3.4","tag":"v1.3.4","candidate_commit_sha":"f03c78bab54efe1cd1596d51cf3f28193232e2a3"},"candidate_commit_sha":"f03c78bab54efe1cd1596d51cf3f28193232e2a3","source":{"path":"priv/journey_evidence/phoenix_clean_room_1.3.4_fifth_failed_attempt.json","sha256":"d6f7c0935eb04c9dedbd26813c72832b2c5a3a85768c4e0a19d185b511d3374b","commit":"81ba9aad5cfab61b8cfe111b0092c9f7221853b7"},"facts":{"advisory":true,"candidate_sha":"f03c78bab54efe1cd1596d51cf3f28193232e2a3","cleanup":"removed","commands":["mix archive install hex phx_new 1.8.5 --force","mix phx.new --no-install --no-ecto --no-html --no-assets --no-mailer","mix deps.get"],"next_action":"Diagnose the exact public Rendro lock tuple before authorizing any new attempt.","outcome":"failure","prerequisite_sha":"f03c78bab54efe1cd1596d51cf3f28193232e2a3","reason":"invalid_rendro_lock","schema_version":1,"version":"1.3.4"},"narrative":{"role":"explanatory_sidecar","path":"journey/journey-005.md","sha256":"2f80cabc688c9393ba3c4eec1d91fa8da29ad8964d858f9ec2183fe170d46427"},"import":{"imported_at":"2026-08-26","reason":"preserved fifth bounded clean-room failure without re-asserting it"},"redaction":{"classification":"none","reason":"Source contained no paths, ports, PIDs, bodies, caches, headers, tokens, secrets, or generated payloads."},"supersedes":[]}
