{"schema_version":1,"role":"journey_attempt","id":"RE-V134-JOURNEY-003","release":{"version":"1.3.4","tag":"v1.3.4","candidate_commit_sha":"f03c78bab54efe1cd1596d51cf3f28193232e2a3"},"candidate_commit_sha":"f03c78bab54efe1cd1596d51cf3f28193232e2a3","source":{"path":"priv/journey_evidence/phoenix_clean_room_1.3.4_third_failed_attempt.json","sha256":"e299610dd0d66d660f8148d6bdd0fbf92df5ebb60bdc55fae2764d523c638658","commit":"01b64464b0b5fea14527b29957fb03d36a6a3a7b"},"facts":{"advisory":true,"candidate_sha":"f03c78bab54efe1cd1596d51cf3f28193232e2a3","cleanup":"removed","commands":["mix archive install hex phx_new 1.8.5 --force","mix phx.new --no-install --no-ecto --no-html --no-assets --no-mailer"],"next_action":"Investigate why the isolated .ez archive inspection still yields phx_new_source_missing before authorizing a new attempt.","outcome":"failure","prerequisite_sha":"f03c78bab54efe1cd1596d51cf3f28193232e2a3","reason":"phx_new_source_missing","schema_version":1,"version":"1.3.4"},"narrative":{"role":"explanatory_sidecar","path":"journey/journey-003.md","sha256":"f53c270e07c9402409ea486888b0cf0bb9cfd49612b6b98670cfd8ac48120f26"},"import":{"imported_at":"2026-08-26","reason":"preserved third bounded clean-room failure without re-asserting it"},"redaction":{"classification":"none","reason":"Source contained no paths, ports, PIDs, bodies, caches, headers, tokens, secrets, or generated payloads."},"supersedes":[]}
