{"schema_version":1,"role":"journey_attempt","id":"RE-V134-JOURNEY-008","release":{"version":"1.3.4","tag":"v1.3.4","candidate_commit_sha":"f03c78bab54efe1cd1596d51cf3f28193232e2a3"},"candidate_commit_sha":"f03c78bab54efe1cd1596d51cf3f28193232e2a3","source":{"path":"priv/journey_evidence/phoenix_clean_room_1.3.4_seventh_failed_attempt.json","sha256":"d03753cf77dd4f2a642053a7ebd486ba2c95c253275f1f05bcc34ea63ff13350","commit":"0006fd9707898e306c10b485315062131921aa8d"},"facts":{"advisory":true,"candidate_sha":"f03c78bab54efe1cd1596d51cf3f28193232e2a3","cleanup":"removed","commands":["mix archive install hex phx_new 1.8.5 --force","mix phx.new --no-install --no-ecto --no-html --no-assets --no-mailer","mix deps.get","mix test"],"next_action":"Inspect the generated consumer compile failure before authorizing any new attempt.","outcome":"failure","prerequisite_sha":"f03c78bab54efe1cd1596d51cf3f28193232e2a3","reason":"generated_consumer_test_command_failed","schema_version":1,"version":"1.3.4"},"narrative":{"role":"explanatory_sidecar","path":"journey/journey-008.md","sha256":"2016ed177e279bc98aa94ff39c736ac382a29b14812e2b6d5800b16e2048feab"},"import":{"imported_at":"2026-08-26","reason":"preserved seventh bounded clean-room failure without re-asserting it"},"redaction":{"classification":"none","reason":"Source contained no paths, ports, PIDs, bodies, caches, headers, tokens, secrets, or generated payloads."},"supersedes":[]}
