{"schema_version":1,"role":"journey_attempt","id":"RE-V134-JOURNEY-001","release":{"version":"1.3.4","tag":"v1.3.4","candidate_commit_sha":"f03c78bab54efe1cd1596d51cf3f28193232e2a3"},"candidate_commit_sha":"f03c78bab54efe1cd1596d51cf3f28193232e2a3","source":{"path":"priv/journey_evidence/phoenix_clean_room_1.3.4_failed_attempt.json","sha256":"8cb4a6a1d00e7b1160531ac3a01b8bbf989e16d9d84e1601a5d69134dfe57436","commit":"a00010bb91484cb102e721c847efaaf8bc0a4724"},"facts":{"advisory":true,"candidate_sha":"f03c78bab54efe1cd1596d51cf3f28193232e2a3","cleanup":"removed","commands":["mix phx.new --no-install --no-ecto --no-html --no-assets --no-mailer"],"next_action":"Install the legitimate Phoenix generator (phx_new) and rerun the harness once from an empty isolated root.","outcome":"failure","prerequisite_sha":"f03c78bab54efe1cd1596d51cf3f28193232e2a3","reason":"mix phx.new is unavailable in this execution environment; no Phoenix consumer was generated.","schema_version":1,"version":"1.3.4"},"narrative":{"role":"explanatory_sidecar","path":"journey/journey-001.md","sha256":"c42d9969dc6aaecefb60a753438230130ff63110398390f63efcbf682c3cc13f"},"import":{"imported_at":"2026-08-26","reason":"preserved first bounded clean-room failure without re-asserting it"},"redaction":{"classification":"none","reason":"Source contained no paths, ports, PIDs, bodies, caches, headers, tokens, secrets, or generated payloads."},"supersedes":[]}
