{"schema_version":1,"role":"journey_attempt","id":"RE-V134-JOURNEY-004","release":{"version":"1.3.4","tag":"v1.3.4","candidate_commit_sha":"f03c78bab54efe1cd1596d51cf3f28193232e2a3"},"candidate_commit_sha":"f03c78bab54efe1cd1596d51cf3f28193232e2a3","source":{"path":"priv/journey_evidence/phoenix_clean_room_1.3.4_fourth_failed_attempt.json","sha256":"efc0d3303a946b20dfe60832b368a2b643cfad80b768a5517b261c54a0c1bba1","commit":"caf9e256fcf99c2fbb8770a1107a575390ec83eb"},"facts":{"advisory":true,"candidate_sha":"f03c78bab54efe1cd1596d51cf3f28193232e2a3","cleanup":"removed","commands":["mix archive install hex phx_new 1.8.5 --force","mix phx.new --no-install --no-ecto --no-html --no-assets --no-mailer"],"next_action":"Diagnose the isolated expanded phx_new archive inspection before authorizing any new attempt.","outcome":"failure","prerequisite_sha":"f03c78bab54efe1cd1596d51cf3f28193232e2a3","reason":"phx_new_source_missing","schema_version":1,"version":"1.3.4"},"narrative":{"role":"explanatory_sidecar","path":"journey/journey-004.md","sha256":"4b46c1e8660cba574ed55f191bc2810632499d34386399ea2700adde2b9969b6"},"import":{"imported_at":"2026-08-26","reason":"preserved fourth bounded clean-room failure without re-asserting it"},"redaction":{"classification":"none","reason":"Source contained no paths, ports, PIDs, bodies, caches, headers, tokens, secrets, or generated payloads."},"supersedes":[]}
