{"schema_version":1,"role":"journey_attempt","id":"RE-V134-JOURNEY-002","release":{"version":"1.3.4","tag":"v1.3.4","candidate_commit_sha":"f03c78bab54efe1cd1596d51cf3f28193232e2a3"},"candidate_commit_sha":"f03c78bab54efe1cd1596d51cf3f28193232e2a3","source":{"path":"priv/journey_evidence/phoenix_clean_room_1.3.4_second_failed_attempt.json","sha256":"e36e6671dfe69a3c783bc4ce069708b650e089e8d27f1fc5f4d0b4666f2a5b51","commit":"ed69d9c905a4d495444bdd6215513b51c4265b6d"},"facts":{"advisory":true,"candidate_sha":"f03c78bab54efe1cd1596d51cf3f28193232e2a3","cleanup":"removed","commands":["mix archive install hex phx_new 1.8.5 --force","mix phx.new --no-install --no-ecto --no-html --no-assets --no-mailer"],"next_action":"Correct the isolated phx_new archive-layout audit, then run one new approved attempt from a fresh empty root.","outcome":"failure","prerequisite_sha":"f03c78bab54efe1cd1596d51cf3f28193232e2a3","reason":"phx_new_source_missing","schema_version":1,"version":"1.3.4"},"narrative":{"role":"explanatory_sidecar","path":"journey/journey-002.md","sha256":"1d008406a451b23ff99462dcc5da2888dee49954c8dc1927b322d4198efe6a6c"},"import":{"imported_at":"2026-08-26","reason":"preserved second bounded clean-room failure without re-asserting it"},"redaction":{"classification":"none","reason":"Source contained no paths, ports, PIDs, bodies, caches, headers, tokens, secrets, or generated payloads."},"supersedes":[]}
